id,question_text
1,1982年我出生了，奶奶对母亲说：
2,在小学期间邻座的男同学总是欺负我：在做回座位时会假装不小心撞一下我的肩膀；在学校与我擦肩而过时会用手臂去用力撞我；跟我借文具时，用完不会马上归还，我想他要回时，他会故意把东西丢到远处或者坐在屁股下，有时甚至耍赖说自己根本没有借。在我不借给他东西后，他开始挑我的语病，嘲笑我的穿着，把我的书包放在莫名其妙的地方害得我找不到。在我忍无可忍开始向老师提出更换座位的要求后，老师说：
3,高中从补习班回家等公交车时，一起等车的陌生男同学向我打招呼，并走到我身边和我试图搭话并乘坐同一辆公交车。在车上透过车窗频频观察我，让我感到害怕。于是我借用陌生上班族姐姐的手机，让爸爸来公交车站接我。下车时，车站并没有父亲的身影。我一边祈祷男生不要跟过来，一边发现男生跟在我后面一起下了车。公交车站偏僻，旁边一个路人都没有，男同学紧贴在吓到浑身僵硬的我身后，低声说：“你每次在补习班都坐在我前面啊，还会笑着传讲义给我，每天都会在教室走廊面带微笑地对我说‘我先走了’，怎么今天却把我当成色狼呢？”。我吓傻了心想我根本不记得这个人。就在这时，刚才借我手机的上班族姐姐从公交车下来，边喊“同学！同学！你忘了这个！”边向我跑来。男同学见状立刻跑开，我跌坐在地上放声大哭。父亲这时才从巷子里跑了出来。我对上班族姐姐和父亲解释我根本不认识那个男生。感谢姐姐送她离开后，我和父亲回到家。父亲对我说：
4,大四，在投了61家公司后，我终于获得了一个面试机会。虽然公司的主营业务我一点都不感兴趣，但是随着面试日期逐渐逼近，也慢慢对它产生了好感，最后甚至迫切的希望自己能顺利通过面试。面试当天，所有面试者被分成3人一组进行团体面试，和我一起面试的另外两位面试者，是和我年纪相仿的女性。面试官看完我们的简历和自我介绍后，开始询问我们的校园生活，经历等。最后，坐在最旁边一直只点头聆听的中年男理事终于开口问道：“要是今天各位去拜访客户，但是客户主管一直。。。就是。。。有一些身体上的接触，比如说按你们的肩膀啦，不经意地摸你们的大腿啦，你们知道我在说什么吧？要是你们遇到这种情形会怎么做”。我们依次做了一下回答，最后被录取的是：
5,我毕业后入职了一家公关代理公司。同期的有4人。两个女生，两个男生。我和另一个女生在公司评价很高，前辈们经常开玩笑说：“明明是同期选进来的，那两个男的怎么会和你们差那么多”。两位男生同期也不是特别办事不力，但的确被主管分配处理比较简单的事务。某天公司突然宣布要成立策划组，想尝试从配合客户需求的“乙方身份”转为策划项目的“甲方身份”。虽然不会立即盈利，但只要先打好这种工作模式的基础，业绩一定能稳定增长，我对此很感兴趣，毛遂自荐表示想加入。策划组的组长也表示“如果你能来我们部门，肯定会表现的很出色”。但最终我还是没能加入策划组，反而挑了同期的另两个男生。在私下一次谈话中，我得知策划组的人事是社长的意思。他之所以选择同期的两个男生是因为：
6,我结婚了。长辈们一直在期待我们的好消息。家里的父母，亲戚不停的询问我有没有好消息，为什么还没消息，做过哪些努力等等。虽然我都以还没有生小孩的打算作答，但他们似乎并不相信，自顾自子地断定是因为我怀不上孩子。亲戚们的过度关心让我难以忍受，我很想大声说自己非常健康，生子计划应该和丈夫两个人商量。但只能不停地说“没有啦，没关系”之类的场面话。回家的路上，我和丈夫一直在争吵。我觉得十分心寒，因为自己遭人误解身体有缺陷时，丈夫竟然闭口不语。但老公却认为是我太敏感，过度解读长辈的好意。最后老公向我道歉，并表示：“我有个办法可以不用再听他们唠叨，我们生孩子吧。反正早晚都得要孩子，趁我们还年轻，赶快生一个吧。”我们的确有计划婚后生小孩，他也没说错什么，只是对于我来说，这并不是一件能轻易决定的事情。我无法想象自己怀孕以后身体会起哪些变化，最重要的是，我没有信心兼顾育儿和职场生活。。。看着我不停的叹气，老公拍了拍我的肩膀说：“我会和你一起的，别担心。我会给孩子换尿布，泡奶粉，用开水煮纱布杀菌的。”他还说：“你不要只想着自己会失去什么，要多想想你会得到什么。成为父母是多么令人感动又有意义的事情啊！”对此我表示：
7,几年后我怀孕了，开始烦恼该不该只请产假，还是要请育婴假，或者干脆申请离职。与丈夫商量后我们决定：